{"runId":"h10-007","phase":"6C-H10","workerId":"worker-no-br","agentId":"a7","forkContext":false,"worktreePath":"wt","ownedFiles":["src/app.ts"],"forbiddenFiles":["src/other.ts"],"allowedDependencies":[],"forbiddenDependencies":[],"requiredExports":["init"],"requiredEvidenceOutputs":["test.log"],"requiredScenarios":["happy"],"requiredNegativeControls":["bad"],"inputContextSummary":"Test.","excludedContext":["full_conversation_history","other_worker_capsules"],"handoffRequirements":{"branchResultRequired":true,"branchDeltaRequired":true,"sourceManifestRequired":true,"evidenceManifestRequired":true},"mailboxRequirements":{"mailboxMessageRequired":false},"createdAt":"2026-06-22T23:00:00+08:00"}
